{
  "$schema": "../../../schemas/skill-evals.schema.json",
  "version": 1,
  "skill": "software-doc-writing-standards",
  "trigger_queries": [
    {
      "query": "这份软件文档现在把需求、设计和 API 说明混在一起了，帮我判断该怎么拆分和重写。",
      "should_trigger": true,
      "notes": "命中文档类型路由与共性规范。"
    },
    {
      "query": "我想建立一套统一的软件文档写作口径，覆盖需求、设计、教程和 reference。",
      "should_trigger": true,
      "notes": "命中跨文档规范。"
    },
    {
      "query": "根据这份功能说明直接把代码写出来。",
      "should_trigger": false,
      "notes": "这是实现任务，不是文档规范任务。"
    },
    {
      "query": "给我写一篇官网营销文案，突出价值主张和品牌语气。",
      "should_trigger": false,
      "notes": "市场文案不属于软件文档写作规范。"
    }
  ],
  "output_cases": [
    {
      "id": "doc-routing",
      "prompt": "用户给了一篇混合草稿，既有上手步骤，又有参数表，还有设计取舍。请判断应该拆成哪些软件文档，并说明理由。",
      "comparison_mode": "with-vs-without-skill",
      "success_criteria": [
        "明确指出文档类型混杂，而不是直接润色原文。",
        "按读者目标拆成 requirements/design/tutorial/how-to/reference/explanation 中的合适类型。",
        "说明每类文档的真源、canonical path 和边界。"
      ]
    },
    {
      "id": "quality-review",
      "prompt": "评审这份软件文档体系是否可验证、可追溯、没有把假设写成事实。",
      "comparison_mode": "with-vs-without-skill",
      "success_criteria": [
        "能单独指出 assumptions、gaps、open questions。",
        "会检查 traceability，而不是只给泛泛写作建议。",
        "会检查文档状态、真源唯一性和替代/归档关系。",
        "不会编造缺失的规范或事实。"
      ]
    }
  ]
}
