{
  "$schema": "../../../schemas/skill-evals.schema.json",
  "version": 1,
  "skill": "software-usage-docs",
  "trigger_queries": [
    {
      "query": "给这个命令行工具写一组使用说明，分成新手 tutorial、常见任务 how-to 和命令 reference。",
      "should_trigger": true,
      "notes": "标准使用说明文档任务。"
    },
    {
      "query": "把这份 API 草稿整理成正式 reference，补齐参数、返回值、错误码和示例。",
      "should_trigger": true,
      "notes": "命中 reference/API docs 路径。"
    },
    {
      "query": "把这个新功能的范围、优先级、约束和验收标准先定下来。",
      "should_trigger": false,
      "notes": "这是需求文档任务。"
    },
    {
      "query": "解释一下这个系统为什么采用事件驱动架构，并画出组件交互设计。",
      "should_trigger": false,
      "notes": "这是设计文档任务。"
    }
  ],
  "output_cases": [
    {
      "id": "doc-flavor-split",
      "prompt": "把一份混杂了上手教程、任务步骤和 API 参数表的文档重组为正确的使用文档体系。",
      "comparison_mode": "with-vs-without-skill",
      "success_criteria": [
        "会先按 tutorial/how-to/reference/explanation 进行路由。",
        "不会把所有内容机械地留在一篇长文里。",
        "会说明各部分的读者目标和真源。"
      ]
    },
    {
      "id": "reference-quality",
      "prompt": "写一版 API reference，要求对接方能快速查 syntax、parameters、responses、errors 和 example。",
      "comparison_mode": "with-vs-without-skill",
      "success_criteria": [
        "结构贴近真实接口面，而不是写成教程。",
        "会覆盖参数、返回、错误和版本/鉴权说明。",
        "示例可复制，并标注 baseline 或版本。"
      ]
    }
  ]
}
