{
  "$schema": "../../../schemas/skill-evals.schema.json",
  "version": 1,
  "skill": "your-skill-name",
  "trigger_queries": [
    {
      "query": "Replace with a real prompt that should trigger this skill.",
      "should_trigger": true,
      "notes": "Explain why this prompt should trigger the skill."
    },
    {
      "query": "Replace with another real prompt that should trigger this skill.",
      "should_trigger": true
    },
    {
      "query": "Replace with a neighboring prompt that should not trigger this skill.",
      "should_trigger": false,
      "notes": "Explain why this prompt should not trigger the skill."
    },
    {
      "query": "Replace with another prompt that should not trigger this skill.",
      "should_trigger": false
    }
  ],
  "output_cases": [
    {
      "id": "case-1",
      "prompt": "Replace with a real prompt that should be compared with and without the skill.",
      "comparison_mode": "with-vs-without-skill",
      "success_criteria": [
        "List at least one observable quality check.",
        "Keep every criterion concrete and easy to verify."
      ]
    },
    {
      "id": "case-2",
      "prompt": "Replace with a second real prompt for comparison.",
      "comparison_mode": "with-vs-without-skill",
      "success_criteria": [
        "Keep the criteria short and measurable."
      ]
    }
  ]
}
