{
  "$schema": "../../../schemas/skill-evals.schema.json",
  "version": 1,
  "skill": "software-doc-suite-workflow",
  "trigger_queries": [
    {
      "query": "这个支付功能上线前，帮我同步需求、详细设计、API reference 和用户操作手册，并告诉我哪些旧文档该归档。",
      "should_trigger": true,
      "notes": "一次变更影响多类文档，需要 impact matrix 和同步顺序。"
    },
    {
      "query": "本次账号体系重构会影响哪些软件文档？请做一份 impact matrix，说明哪些更新、哪些保持不变。",
      "should_trigger": true,
      "notes": "命中文档套件盘点与路由。"
    },
    {
      "query": "这个接口准备废弃，帮我处理 requirements、design、reference 和 how-to 的替代关系与归档动作。",
      "should_trigger": true,
      "notes": "命中多文档替代与归档。"
    },
    {
      "query": "清理一下这个仓库的软件文档，找出平行真源、过时状态和断链关系。",
      "should_trigger": true,
      "notes": "命中文档治理场景。"
    },
    {
      "query": "只帮我写一版新的 feature spec。",
      "should_trigger": false,
      "notes": "单篇需求文档，应走 requirements skill。"
    },
    {
      "query": "只补这条 CLI 命令的 reference 文档。",
      "should_trigger": false,
      "notes": "单篇 reference 文档，应走 usage/reference skill。"
    },
    {
      "query": "解释一下这个系统为什么采用事件驱动架构。",
      "should_trigger": false,
      "notes": "单篇解释或设计说明，不是套件编排。"
    },
    {
      "query": "根据这份设计文档直接把代码实现出来。",
      "should_trigger": false,
      "notes": "实现任务，不是文档工作流。"
    }
  ],
  "output_cases": [
    {
      "id": "suite-sync-matrix",
      "prompt": "对一个即将上线的新功能做文档套件同步，要求说明 requirements、design、usage、reference、ADR 的处理动作和顺序。",
      "comparison_mode": "with-vs-without-skill",
      "success_criteria": [
        "先做 inventory 和 change classification，而不是直接改某一篇文档。",
        "输出 impact matrix，且每类文档都有 action 和 canonical path。",
        "明确同步顺序，并区分已执行更新和建议更新。"
      ]
    },
    {
      "id": "stale-doc-governance",
      "prompt": "治理一个文档仓库，识别平行真源、过时设计和缺失的 supersede/archive 动作。",
      "comparison_mode": "with-vs-without-skill",
      "success_criteria": [
        "会单独指出 canonical-source 问题，而不是只润色正文。",
        "会给出 deprecate/archive/no-change 的明确动作。",
        "会检查 requirements/design/usage/reference 之间的断链关系。"
      ]
    }
  ]
}
